{
  "version": "1.0.0",
  "description": "专业代码映射配置",
  "mappings": {
    "PR": {
      "name": "工艺",
      "full_name": "工艺专业",
      "skill_group": "vdi-process-lead",
      "lead_skill": "vdi-process-lead",
      "sub_skills": [
        "vdi-process-route",
        "vdi-process-balance",
        "vdi-process-pfd-pid",
        "vdi-process-equipment",
        "vdi-process-safety",
        "vdi-process-utilities"
      ],
      "shared_utils": [
        "vdi-process-calc",
        "vdi-process-simulation"
      ],
      "mcp_required": ["vdi-orchestrator", "vdi-knowledge", "vdi-rules"],
      "color": "#6366f1",
      "icon": "⚗️"
    },
    "WA": {
      "name": "给排水",
      "full_name": "给排水专业",
      "skill_group": "vdi-water-lead",
      "lead_skill": "vdi-water-lead",
      "sub_skills": [
        "vdi-water-supply",
        "vdi-water-fire",
        "vdi-water-drainage",
        "vdi-water-stormwater",
        "vdi-water-wastewater",
        "vdi-water-circulating"
      ],
      "shared_utils": [
        "vdi-water-hydraulics",
        "vdi-water-equipment"
      ],
      "mcp_required": ["vdi-orchestrator", "vdi-knowledge", "vdi-rules"],
      "color": "#8b5cf6",
      "icon": "💧"
    },
    "PI": {
      "name": "管道",
      "full_name": "管道专业",
      "skill_group": "vdi-piping-lead",
      "lead_skill": "vdi-piping-lead",
      "sub_skills": [],
      "shared_utils": [],
      "mcp_required": ["vdi-orchestrator", "vdi-knowledge", "vdi-rules"],
      "color": "#a78bfa",
      "icon": "🔧",
      "status": "pending",
      "note": "待创建Skill定义"
    },
    "IN": {
      "name": "仪控",
      "full_name": "仪控专业",
      "skill_group": "vdi-instrument-lead",
      "lead_skill": "vdi-instrument-lead",
      "sub_skills": [],
      "shared_utils": [],
      "mcp_required": ["vdi-orchestrator", "vdi-knowledge", "vdi-rules"],
      "color": "#c4b5fd",
      "icon": "📊",
      "status": "pending",
      "note": "待创建Skill定义"
    },
    "EL": {
      "name": "电气",
      "full_name": "电气专业",
      "skill_group": "vdi-electrical-lead",
      "lead_skill": "vdi-electrical-lead",
      "sub_skills": [],
      "shared_utils": [],
      "mcp_required": ["vdi-orchestrator", "vdi-knowledge", "vdi-rules"],
      "color": "#ddd6fe",
      "icon": "⚡",
      "status": "pending",
      "note": "待创建Skill定义"
    },
    "EQ": {
      "name": "设备",
      "full_name": "设备专业",
      "skill_group": "vdi-equipment-lead",
      "lead_skill": "vdi-equipment-lead",
      "sub_skills": [],
      "shared_utils": [],
      "mcp_required": ["vdi-orchestrator", "vdi-knowledge", "vdi-rules"],
      "color": "#ede9fe",
      "icon": "🏭",
      "status": "pending",
      "note": "待创建Skill定义"
    },
    "HS": {
      "name": "HSE",
      "full_name": "健康安全环保专业",
      "skill_group": "vdi-hse-lead",
      "lead_skill": "vdi-hse-lead",
      "sub_skills": [],
      "shared_utils": [],
      "mcp_required": ["vdi-orchestrator", "vdi-knowledge", "vdi-rules"],
      "color": "#f5f3ff",
      "icon": "🛡️",
      "status": "pending",
      "note": "待创建Skill定义"
    },
    "ST": {
      "name": "结构",
      "full_name": "结构专业",
      "skill_group": "vdi-structural-lead",
      "lead_skill": "vdi-structural-lead",
      "sub_skills": [],
      "shared_utils": [],
      "mcp_required": ["vdi-orchestrator", "vdi-knowledge", "vdi-rules"],
      "color": "#e0e7ff",
      "icon": "🏗️",
      "status": "pending",
      "note": "待创建Skill定义"
    },
    "AR": {
      "name": "建筑",
      "full_name": "建筑专业",
      "skill_group": "vdi-architectural-lead",
      "lead_skill": "vdi-architectural-lead",
      "sub_skills": [],
      "shared_utils": [],
      "mcp_required": ["vdi-orchestrator", "vdi-knowledge", "vdi-rules"],
      "color": "#dbeafe",
      "icon": "🏛️",
      "status": "pending",
      "note": "待创建Skill定义"
    },
    "MA": {
      "name": "材料",
      "full_name": "材料专业",
      "skill_group": "vdi-material-lead",
      "lead_skill": "vdi-material-lead",
      "sub_skills": [],
      "shared_utils": [],
      "mcp_required": ["vdi-orchestrator", "vdi-knowledge"],
      "color": "#bfdbfe",
      "icon": "🔩",
      "status": "pending",
      "note": "待创建Skill定义"
    },
    "HV": {
      "name": "暖通",
      "full_name": "暖通专业",
      "skill_group": "vdi-hvac-lead",
      "lead_skill": "vdi-hvac-lead",
      "sub_skills": [],
      "shared_utils": [],
      "mcp_required": ["vdi-orchestrator", "vdi-knowledge", "vdi-rules"],
      "color": "#93c5fd",
      "icon": "🌡️",
      "status": "pending",
      "note": "待创建Skill定义"
    },
    "FI": {
      "name": "消防",
      "full_name": "消防专业",
      "skill_group": "vdi-fire-lead",
      "lead_skill": "vdi-fire-lead",
      "sub_skills": [],
      "shared_utils": [],
      "mcp_required": ["vdi-orchestrator", "vdi-knowledge", "vdi-rules"],
      "color": "#60a5fa",
      "icon": "🚒",
      "status": "pending",
      "note": "待创建Skill定义"
    },
    "PROC": {
      "name": "采购",
      "full_name": "采购部门",
      "skill_group": "vdi-procurement",
      "lead_skill": "vdi-procurement",
      "sub_skills": [],
      "shared_utils": [],
      "mcp_required": ["vdi-orchestrator"],
      "color": "#3b82f6",
      "icon": "📦",
      "status": "pending",
      "note": "待创建Skill定义"
    },
    "QA": {
      "name": "质量",
      "full_name": "质量部门",
      "skill_group": "vdi-quality-assurance",
      "lead_skill": "vdi-quality-assurance",
      "sub_skills": [],
      "shared_utils": [],
      "mcp_required": ["vdi-orchestrator", "vdi-rules"],
      "color": "#2563eb",
      "icon": "✅",
      "status": "pending",
      "note": "待创建Skill定义"
    },
    "MG": {
      "name": "管理",
      "full_name": "项目管理",
      "skill_group": "vdi-design-manager",
      "lead_skill": "vdi-design-manager",
      "sub_skills": [
        "vdi-scheduler-agent",
        "vdi-doc-export",
        "vdi-doc-ingest"
      ],
      "shared_utils": [],
      "mcp_required": ["vdi-orchestrator", "vdi-knowledge"],
      "color": "#1d4ed8",
      "icon": "👔"
    },
    "HAZOP": {
      "name": "HAZOP",
      "full_name": "HAZOP分析",
      "skill_group": "hazop-chair",
      "lead_skill": "hazop-chair",
      "sub_skills": [
        "hazop-expert-process",
        "hazop-expert-instrument",
        "hazop-expert-equipment",
        "hazop-expert-safety",
        "hazop-expert-operation",
        "hazop-prep-assistant",
        "hazop-matrix-assistant",
        "hazop-scenario-assistant",
        "hazop-qa-assistant",
        "hazop-report-assistant",
        "hazop-inherent-safety"
      ],
      "shared_utils": [],
      "mcp_required": ["vdi-knowledge", "vdi-rules"],
      "color": "#7c3aed",
      "icon": "⚠️"
    },
    "SY": {
      "name": "系统",
      "full_name": "系统管理",
      "skill_group": "vdi-system-health",
      "lead_skill": "vdi-system-health",
      "sub_skills": [],
      "shared_utils": [],
      "mcp_required": ["vdi-knowledge"],
      "color": "#6b7280",
      "icon": "⚙️"
    }
  },
  "reverse_mappings": {
    "vdi-process-lead": "PR",
    "vdi-water-lead": "WA",
    "vdi-piping-lead": "PI",
    "vdi-instrument-lead": "IN",
    "vdi-electrical-lead": "EL",
    "vdi-equipment-lead": "EQ",
    "vdi-hse-lead": "HS",
    "vdi-structural-lead": "ST",
    "vdi-architectural-lead": "AR",
    "vdi-material-lead": "MA",
    "vdi-hvac-lead": "HV",
    "vdi-fire-lead": "FI",
    "vdi-procurement": "PROC",
    "vdi-quality-assurance": "QA",
    "vdi-design-manager": "MG",
    "hazop-chair": "HAZOP",
    "vdi-system-health": "SY"
  }
}